Column,char,dialog,movie
1198,FRODO,I Can See The Shire. The Brandywine River. Bag End. Gandalf's Fireworks. The Lights On The Party Tree.,The Return of the King
1199,SAM,"Rosie Cotton Dancing. , She Had Ribbons In Her Hair. If Ever I Was To Marry Someone, It Would Have Been Her. , It Would've Been Her.",The Return of the King
1200,FRODO,I'm Glad To Be With You Samwise Gamgee Here At The End Of All Things. They Hug.,The Return of the King
1201,DENETHOR,"I Am Steward Of The House Of An'rion. Thus Have I Walked, And Thus Now I Will Sleep.",The Return of the King
1202,DENETHOR,"Gondor Is Lost. There Is No Hope For Men. , Why Do The Fools Fly? Better To Die Sooner Than Late. For Die We Must.",The Return of the King
1203,DENETHOR,"No Tomb For Denethor And Faramir. No Long Slow Sleep Of Death Embalmed. We Shall Burn Like The Heathen Kings Of Old. , Bring Wood And Oil.",The Return of the King
1204,GANDALF,Steady! Steady!,The Return of the King
1205,GANDALF,You Are Soldiers Of Gondor. No Matter What Comes Through That Gate You Will Stand Your Ground.,The Return of the King
1206,GANDALF,"Volley! , Fire!",The Return of the King
1207,SAM,"Let Him Go, You Filth! Let Him Go!",The Return of the King
1208,SAM,"You Will Not Touch Him Again! , Come On Then, Finish It!",The Return of the King
1209,GIMLI,Keep Breathing. That's The Key.Breathe.,The Two Towers
1210,LEGOLAS,They've Run As If The Very Whipsof Their Masters Were Behind Them.,The Two Towers
1211,ORC,We're Not Going No Further......Until We've Had A Breather.,The Two Towers
1212,UGLUK,Get A Fire Going!,The Two Towers
1213,PIPPIN,Merry!merry!,The Two Towers
1214,MERRY,"I Think We Might Have Made A Mistakeleaving The Shire, Pippin.",The Two Towers
1215,PIPPIN,What's Making That Noise?,The Two Towers
1216,MERRY,It's The Trees.,The Two Towers
1217,GANDALF,"Peregrin Took My Lad, There Is A Task Now To Be Done.  Another Opportunity For One Of The Shire Folk To Prove Their Great Worth.  , You Must Not Fail Me.",The Return of the King
1218,FARAMIR,It's Been Very Quiet Across The River.,The Return of the King
1219,MADRIL,"The Orcs Are Lying Low.  The Garrison May Have Moved Out.  We've Sent Scouts To Cair Andros.  If The Orcs Attack From The North, We'll Have Some Warning.",The Return of the King
1220,GOTHMOG,Quiet.,The Return of the King
1221,SOLDIER,We Need 10 More.,The Return of the King
1222,EOWYN,No.,The Return of the King
1223,THEODEN,"I Go To My Fathers, In Whose Mighty Company; I Shall Not Now Feel Ashamed.",The Return of the King
1224,THEODEN,Eowyn.,The Return of the King
1225,KING OF THE DEAD,Release Us!,The Return of the King
1226,GIMLI,"Bad Idea! Very Handy In A Tight Spot These Lads, Despite The Fact They're Dead.",The Return of the King
1227,KING OF THE DEAD,You Gave Us Your Word!,The Return of the King
1228,ARAGORN,I Hold Your Oath Fulfilled. Go. Be At Peace.,The Return of the King
1229,PIPPIN,Merry!,The Return of the King
1230,EOMER,Nooooo!,The Return of the King
1231,EOMER,Nooooooo! Noooooo!,The Return of the King
1232,FRODO,"Lead The Way, Smeagol.",The Two Towers
1233,GOLLUM,Good Smeagol Always Helps.,The Two Towers
1234,MERRY,Hello?treebeard?where Has He Gone?,The Two Towers
1235,PIPPIN,I Had The Loveliest Dream Last Night.There Was This Large Barrelfull Of Pipe-weed.And We Smoked All Of It.And Then......You Were Sick.I'd Give Anything For A Whiff Of Old Toby.,The Two Towers
1236,MERRY,Did You Hear That?there It Is Again.Something's Not Right Here.Not Right At All.,The Two Towers
1237,MERRY,You Just Said Something...Treeish.,The Two Towers
1238,PIPPIN,"No, I Didn't. I Was Just Stretching.",The Two Towers
1239,MERRY,You're Taller.,The Two Towers
1240,PIPPIN,Who?,The Two Towers
1241,MERRY,You!,The Two Towers
1242,PIPPIN,Than What?,The Two Towers
1243,MERRY,Than Me!,The Two Towers
1244,PIPPIN,I've Always Been Taller Than You.,The Two Towers
1245,MERRY,"Pippin, Everyone Knows I'm The Tall One.You're The Short One.",The Two Towers
1246,PIPPIN,"Please, Merry.You're What? Three-foot-six? At The Most?whereas Me, I'm Pushing 3'7"". ,3'8""!",The Two Towers
1247,SHAGRAT,"It's Going To The Great Eye, Along With Everything Else.",The Return of the King
1248,GORBAG,I Don't Take Orders From Stinking Morgul-rats!,The Return of the King
1249,SHAGRAT,You Touch It And I'll Stick This Blade In Your Gut!,The Return of the King
1250,GORBAG,The Scum Tried To Knife Me. Kill Him!,The Return of the King
1251,SAM,That's For Frodo!,The Return of the King
1252,SAM,And The Shire!,The Return of the King
1253,SAM,And That's For My Old Gaffer!,The Return of the King
1254,SHAGRAT,Stop Your Squealing You Dunghill Rat!,The Return of the King
1255,SHAGRAT,I'm Gonna Bleed You Like A Stuck Pig!,The Return of the King
1256,SAM,Not If I Stick You First!,The Return of the King
1257,FRODO,Sam!,The Return of the King
1258,FRODO,"Oh Sam, I'm So Sorry. Sorry For Everything.",The Return of the King
1259,SAM,Let's Get You Out Of Here.,The Return of the King
1260,ARAGORN,Rohan.Home Of The Horse-lords.There's Something Strange At Work Here.Some Evil Gives Speedto These Creatures.Sets Its Will Against Us.,The Two Towers
1261,ARAGORN,Legolas! What Do Your Elf-eyes See?,The Two Towers
1262,LEGOLAS,The Uruks Turn Northeast.They Are Taking The Hobbits To Lsengard.,The Two Towers
1263,ARAGORN,Saruman.,The Two Towers
1264,SARUMAN VOICE OVER,The World Is Changing.Who Now Has The Strength To Standagainst The Armies Of Isengard......And Mordor?to Stand Against The Might Of Sauronand Saruman......And The Union Of The Two Towers?,The Two Towers
1265,SARUMAN VOICE OVER,"Together, My Lord Sauron...... We Shall Rule This Middle-earth.",The Two Towers
1266,SARUMAN VOICE OVER,The Old World Will Burnin The Fires Of Industry.The Forests Will Fall.A New Order Will Rise.We Will Drive The Machine Of Warwith The Sword And The Spear...... And The Iron Fists Of The Orc. We Have Only To Remove Those Who Oppose Us.,The Two Towers
1267,SARUMAN,I Want Them Armed And Ready To Marchwithin Two Weeks!,The Two Towers
1268,ORC,"But, My Lord, There Are Too Many!they Cannot All Be Armed In Timewe Don't Have The Means.",The Two Towers
1269,SARUMAN,"Build A Dam, Block The Streamwork The Furnaces Night And Day.",The Two Towers
1270,ORC,We Don't Have Enough Fuelto Feed The Fires.,The Two Towers
1271,TREEBEARD,"Hobbits?never Heard Of A Hobbit Before.Sounds Like Orc Mischief To Me! ,they Come With Fire.They Come With Axes.Gnawing, Biting, Breakinghacking, Burning! Destroyers And Usurpers! Curse Them!",The Two Towers
1272,MERRY,No!you Don't Understand. We're Hobbits!halflings!shire-folk!,The Two Towers
1273,TREEBEARD,Maybe You Are......And Maybe You Aren't.The White Wizard Will Know.,The Two Towers
1274,PIPPIN,The White Wizard?,The Two Towers
1275,MERRY,Saruman.,The Two Towers
1276,GOLLUM,"See? See?we've Led You Out.Hurry, Hobbitses. Hurry! Very Lucky We Find You. ,nice Hobbit.",The Two Towers
1277,SAM,It's A Bog. He's Led Us Into A Swamp.,The Two Towers
1278,GOLLUM,"A Swamp, Yes, Yes.Come, Master. We Will Take Youon Safe Paths Through The Mist.Come, Hobbits! Come! We Go Quickly. ,i Found It. I Did.The Way Through The Marshes.Orcs Don't Use It.Orcs Don't Know It.They Go Around For Miles And Miles.Come Quickly.Soft And Quick As Shadows We Must Be.",The Two Towers
1279,SAM,I Hate This Place. It's Too Quiet.There's Been No Sight Nor Soundof A Bird For Two Days.,The Two Towers
1280,GOLLUM,"No, No Birdses To Eat.No Crunchable Birdses.We Are Famished! Yes!famished We Are, Precious!",The Two Towers
1281,FRODO,Here.,The Two Towers
1282,GOLLUM,"What Does It Eats?is It Tasty? ,it Tries To Chokes Us!we Can't Eats Hobbit Food!we Must Starve!",The Two Towers
1283,SAM,"Well, Starve, Then. And Good Riddance!",The Two Towers
1284,GOLLUM,"Oh, Cruel Hobbit.It Does Not Care If We Be Hungry.Does Not Care If We Should Die. ,not Like Master.Master Cares.Master Knows.Yes.Precious.Once It Takes Hold Of Us......It Never Lets Go.",The Two Towers
1285,FRODO,Don't Touch Me!,The Two Towers
1286,GANDALF,"Fly, You Fools!",The Two Towers
1287,FRODO,No!gandalf!,The Two Towers
1288,FRODO,Gandalf!,The Two Towers
1289,SAM,"What Is It, Mr. Frodo?",The Two Towers
1290,FRODO,Nothing.Just A Dream.,The Two Towers
1291,SAM,Can You See The Bottom?,The Two Towers
1292,FRODO,"No! Don't Look Down, Sam!just Keep Going!",The Two Towers
1293,SAM,"Catch It! Grab It, Mr. Frodo!",The Two Towers
1294,SAM,Mr. Frodo!,The Two Towers
1295,FRODO,I Think I've Found The Bottom.,The Two Towers
1296,SAM,Bogs And Ropeand Goodness Knows What.It's Not Natural. None Of It.,The Two Towers
1297,FRODO,What's In This?,The Two Towers
1298,SAM,Nothing.Just A Bit Of Seasoning.I Thought Maybe If We Was Havinga Roast Chicken One Night Or Something.,The Two Towers
1299,FRODO,Roast Chicken?!,The Two Towers
1300,SAM,Back!,The Return of the King
1301,SAM,Mr Frodo!,The Return of the King
1302,SAM,"Oh No! Frodo, Mr Frodo. , Wake Up. Don't Leave Me Here Alone. Don't Go Where I Can't Follow. Wake Up. Not Asleep. Dead.",The Return of the King
1303,SHAGRAT,You Get Back You Scum!,The Return of the King
1304,SHAGRAT,What's This?,The Return of the King
1305,ORC,Killed Another One Has She?,The Return of the King
1306,SHAGRAT,"No. , This Fellow Ain't Dead.",The Return of the King
1307,SAM,Not Dead.,The Return of the King
1308,SHAGRAT,She Jabs Him With Her Stinger And He Goes As Limp As A Boned Fish Aaa' Then She Has Her Way With Them. That's How She Likes To Feed. Fresh Blood. Get Him To The Tower!,The Return of the King
1309,SAM,Samwise You Fool.,The Return of the King
1310,ORC,This Scum Will Be Awake In A Couple Of Hours.,The Return of the King
1311,SHAGRAT,Then He'll Wish He'd Never Been Born.,The Return of the King
1312,DENETHOR,"The House Of His Spirit Crumbles., He Is Burning. Already Burning.",The Return of the King
1313,PIPPIN,What?,The Two Towers
1314,MERRY,You Remember The Old Foreston The Borders Of Buckland?folk Used To Say There Was Something Inthe Water That Made The Trees Grow Tall......And Come Alive.,The Two Towers
1315,PIPPIN,Alive?,The Two Towers
1316,MERRY,Trees That Could Whisper......Talk To Each Other......Even Move.,The Two Towers
1317,URUK-HAI,I'm Starving.We Ain't Had Nothing But Maggoty Breadfor Three Stinking Days.,The Two Towers
1318,SNAGA,"Yeah!why Can't We Have Some Meat?! ,what About Them?they're Fresh.",The Two Towers
1319,UGLUK,They Are Not For Eating.,The Two Towers
1320,GRISHNAKH,What About Their Legs?they Don't Need Those.,The Two Towers
1321,GRISHNAKH,They Look Tasty.,The Two Towers
1322,UGLUK,"Get Back, Scum!the Prisoners Go To Saruman.Alive And Unspoiled.",The Two Towers
1323,GRISHNAKH,"Alive? ,why Alive?do They Give Good Sport?",The Two Towers
1324,UGLUK,They Have Something.An Elvish Weapon.The Master Wants It For The War.,The Two Towers
1325,PIPPIN,They Think We Have The Ring.,The Two Towers
1326,MERRY,Ssh!as Soon As They Find Out We Don'twe're Dead.,The Two Towers
1327,GOTHMOG,Kill Him.,The Return of the King
1328,FARAMIR,"They're Not Coming From The North!  To The River Quick, Quick!",The Return of the King
1329,DAMROD,"Go,  Come On!",The Return of the King
1330,GOTHMOG,"Faster!  ,  Draw Swords.",The Return of the King
1331,SOLDIER,Hold!  Hold Them!,The Return of the King
1332,SOLDIER,What?,The Return of the King
1333,GANDALF,Amon D'n.,The Return of the King
1334,SOLDIER,The Beacon!  The Beacon Of Amon D'n Is Lit.,The Return of the King
1335,GANDALF,Hope Is Kindled!,The Return of the King
1336,ARAGORN,The Beacons Of Minas Tirith!  The Beacons Are Lit!,The Return of the King
1337,ARAGORN,Gondor Calls For Aid.,The Return of the King
1338,THEODEN,"And Rohan Will Answer!  Muster The Rohirrim.  ,  Assemble The Army At Dunharrow,  As Many Men As Can Be Found.  You Have Two Days. ,  On The Third, We Ride For Gondor' And War.",The Return of the King
1339,EOMER,Forward!,The Return of the King
1340,MERRY,Three-foot-eight.You Did Something.,The Two Towers
1341,PIPPIN,"Merry, Don't! Don't Drink It!",The Two Towers
1342,PIPPIN,"Merry!no, Treebeard Said That Youshouldn't Have Any.",The Two Towers
1343,MERRY,I Want Some!,The Two Towers
1344,PIPPIN,Lt Could Well Be Dangerous!,The Two Towers
1345,PIPPIN,Give Me It Back. Merry!,The Two Towers
1346,PIPPIN,What's Happening?!,The Two Towers
1347,MERRY,Aaagh!it's Got My Leg!,The Two Towers
1348,PIPPIN,Merry!,The Two Towers
1349,MERRY and PIPPIN,Help!,The Two Towers
1350,TREEBEARD,Away With You.You Should Not Be Waking.Eat Earth. Dig Deep. Drink Water.,The Two Towers
1351,TREEBEARD,"Go To Sleep.Away With You. ,come, The Forest Is Waking Up.",The Two Towers
1352,TREEBEARD,It Isn't Safe.The Trees Have Grown Wildand Dangerous.Anger Festers In Their Hearts.Black Are Their Thoughts.Strong Is Their Hate.They Will Harm You If They Can.There Are Too Few Of Us Now.Too Few Of Us Ents Left To Manage Them.,The Two Towers
1353,FRODO,"It's Too Late. It's Over. They've Taken It Sam, They Took The Ring!",The Return of the King
1354,SAM,Begging Your Pardon But They Haven't.,The Return of the King
1355,SAM,"I Thought I'd Lost You. So I Took It, Only For Safekeeping.",The Return of the King
1356,FRODO,"Give It To Me! , Give Me The Ring Sam. , Sam! Give Me The Ring. , You Must Understand. The Ring Is My Burden. It Will Destroy You Sam.",The Return of the King
1357,SAM,Come On Mr Frodo. We'd Best Find You Some Clothes. You Can't Go Walking Through Mordor In Nowt But Your Skin.,The Return of the King
1358,SAM,We Did It Mr Frodo. We Made It To Mordor.,The Return of the King
1359,FRODO,There Are So Many Of Them. We'll Never Get Through Unseen.,The Return of the King
1360,FRODO,"It's Him, The Eye!",The Return of the King
1361,SAM,"We Have To Go In There Mr Frodo. There's Nothing For It. , Come On Let's Just Make It Down The Hill For Starters.",The Return of the King
1362,GANDALF,"Frodo Has Passed Beyond My Sight. , The Darkness Is Deepening.",The Return of the King
1363,ARAGORN,If Sauron Had The Ring We Would Know It.,The Return of the King
1364,GANDALF,"It's Only A Matter Of Time. He Has Suffered A Defeat, Yes, But Behind The Walls Of Mordor Our Enemy Is Regrouping.",The Return of the King
1365,GIMLI,Let Him Stay There! Let Him Rot! Why Should We Care?,The Return of the King
1366,GANDALF,"Because 10,000 Orcs Now Stand Between Frodo And Mount Doom.",The Return of the King
1367,SARUMAN,The Forest Of Fangornlies On Our Doorstep. Burn It.,The Two Towers
1368,ORC,Yes.,The Two Towers
1369,WILDMAN,We Will Fight For You.,The Two Towers
1370,SARUMAN,Swear It.,The Two Towers
1371,WILDMAN,We Will Die For Saruman.,The Two Towers
1372,SARUMAN,The Horse-men Took Your Lands.They Drove Your People Into The Hillsto Scratch A Living Off Rocks.,The Two Towers
1373,WILDMAN,Murderers!,The Two Towers
1374,SARUMAN,Take Back The Lands They Stole From You.Burn Every Village!,The Two Towers
1375,SARUMAN VOICE OVER,We Have Only To Remove Thosewho Oppose Us.It Will Begin In Rohan.Too Long Have These Peasantsstood Against You.But No More.,The Two Towers
1376,MORWEN,Eothain! Eothain!you Take Your Sister.You'll Go Faster With Just Two.,The Two Towers
1377,MORWEN,Listen To Me. You Must Ride To Edorasand Raise The Alarm. Do You Understand Me?,The Two Towers
1378,SAM,There Are Dead Things!dead Faces In The Water.,The Two Towers
1379,GOLLUM,"All Dead. All Rotten.Elves And Men And Orcses.A Great Battle Long Ago.Dead Marshes.Yes. Yes, That Is Their Name.This Way.Don't Follow The Lights.",The Two Towers
1380,GOLLUM,Careful Now! Or Hobbits Go Downto Join The Dead Ones......And Light Little Candlesof Their Own.,The Two Towers
1381,SAM,Frodo!,The Two Towers
1382,FRODO,Gollum?,The Two Towers
1383,GOLLUM,Don't Follow The Lights.,The Two Towers
1384,FRODO,Gollum!,The Two Towers
1385,SAM,Mr. Frodo!are You All Right?,The Two Towers
1386,GOLLUM,So Bright.So Beautiful.,The Two Towers
1387,GOLLUM,(strokes His Own Palm)our Precious.,The Two Towers
1388,FRODO,What Did You Say?,The Two Towers
1389,GOLLUM,Master Should Be Resting.Master Needs To Keep Up His Strength.,The Two Towers
1390,FRODO,Who Are You?,The Two Towers
1391,GOLLUM,Mustn't Ask Us. Not Its Business.Gollum. Gollum.,The Two Towers
1392,SAM,It Must Be Getting Near Teatime. Leastways It Would Be In Decent Places Where There Is Still Teatime.,The Return of the King
1393,GOLLUM,We're Not In Decent Places.,The Return of the King
1394,SAM,Mr Frodo?  What Is It?,The Return of the King
1395,FRODO,It's Just A Feeling.  I Don't Think I'll Be Coming Back.,The Return of the King
1396,SAM,Yes You Will.  Of Course You Will.  That's Just Morbid Thinking.  We're Going There And Back Again Just Like Mr Bilbo.  You'll See.,The Return of the King
1397,FRODO,I Think These Lands Were Once Part Of The Kingdom Of Gondor.,The Return of the King
1398,FRODO,"Long Ago, When There Was A King.",The Return of the King
1399,SAM,"Mr Frodo, Look!  The King Has Got A Crown Again.",The Return of the King
1400,MERRY,What Are They Eating When They Can't Get Hobbit ?,The Fellowship of the Ring
1402,FRODO,Who Is She ? This Woman You Sing Of ?,The Fellowship of the Ring
1403,STRIDER,Tis The Lady Of L'thien. The Elf Maiden Who Gave Her Love To Beren ... A Mortal,The Fellowship of the Ring
1404,FRODO,What Happened To Her?,The Fellowship of the Ring
1405,STRIDER,She Died.,The Fellowship of the Ring
1406,SARUMAN,The Power Of Isengard Is At Your Command,The Fellowship of the Ring
1407,SARUMAN,Sauron.  Lord Of The Earth,The Fellowship of the Ring
1408,GIMLI,Stay Close Young Hobbits.,The Fellowship of the Ring
1409,GALADRIEL VOICE-OVER,"Frodo! , Frodo!",The Fellowship of the Ring
1410,GIMLI,..And Are Never Seen Again,The Fellowship of the Ring
1411,GALADRIEL VOICE-OVER,"Your Coming To Us , Is As The Footsteps Of Doom. You Bring Great Evil Here! ,ringbearer!",The Fellowship of the Ring
1412,SAM,Mr Frodo ?,The Fellowship of the Ring
1413,GIMLI,"Well!  Here's One Dwarf She Won't Ensnare So Easily! I Have The Eyes Of A Hawk, And Ears Of A Fox!",The Fellowship of the Ring
1414,GIMLI,Oh!,The Fellowship of the Ring
1415,HALDIR,"The Dwarf Breathes So Loud, We Could Have Shot Him In The Dark.",The Fellowship of the Ring
1416,HALDIR,"Mae Govannen, Legolas Thranduilion.",The Fellowship of the Ring
1417,SAM,You Never Know.,The Two Towers
1418,FRODO,Sam. My Dear Sam.,The Two Towers
1419,SAM,"It's Very Special, That.It's The Best Salt In All The Shire.",The Two Towers
1420,FRODO,It Is Special. It's A Little Bit Of Home.,The Two Towers
1421,FRODO,We Can't Leave This Here For Someoneto Follow Us Down.,The Two Towers
1422,SAM,"Who's Gonna Follow Us Down Heremr. Frodo?it's A Shame, Really.Lady Galadriel Gave Me That.Real Elvish Rope. Well, There's Nothing For It.It's One Of My Knots.Won't Come Free In A Hurry.",The Two Towers
1423,FRODO,Real Elvish Rope.,The Two Towers
1424,SAM,"Mordor. The One Place In Middle-earthwe Don't Want To See Any Closer.And It's The One Placewe're Trying To Get To.It's Just Where We Can't Get. Let's Face It, Mr. Frodo, We're Lost.I Don't Think Gandalf Meant For Us Tocome This Way.",The Two Towers
1425,FRODO,"He Didn't Mean For A Lot Of Thingsto Happen, Sam......But They Did.",The Two Towers
1426,SAM,"Mr. Frodo?it's The Ring, Isn't It?",The Two Towers
1427,FRODO,It's Getting Heavier.,The Two Towers
1428,FRODO,What Food Have We Got Left?,The Two Towers
1429,SAM,"Let Me See.Oh, Yes. Lovely.Lembas Bread. And Look!more Lembas Bread.",The Two Towers
1430,SAM,"I Don't Usually Hold With Foreign Food.....But This Elvish Stuff, It's Not Bad.",The Two Towers
1431,FRODO,"Nothing Ever Dampens Your Spiritsdoes It, Sam?",The Two Towers
1432,BILBO,"My Old Sword, Sting , Here, Take It, Take It.",The Fellowship of the Ring
1433,FRODO,Its So Light!,The Fellowship of the Ring
1434,BILBO,"Yes Yes , Made By The Elves You Know.  The Blade Glows Blue When Orcs Are Close And Its Times Like That My Lad, When You Have To Be Extra Careful. Here's A Pretty Thing. , Mithril! , As Light As A Feather And As Hard As Dragon Scales.  Let Me See You Put It On, Go On.",The Fellowship of the Ring
1435,BILBO,"My My Old Ring.  Well I Should... Very Much Like To Hold It Again, One Last Time.",The Fellowship of the Ring
1436,BILBO,"I'm Sorry I Brought This Upon You My Boy , I'm Sorry That You Must Carry This Burden , i'm Sorry For Everything",The Fellowship of the Ring
1437,ELROND,"The Ringbearer Is Setting Out On The Quest Of Mount Doom And You Who Travel With Him, , No Oath Nor Bond Is Laid To Go Further Than You Will , farewell. Hold To Your Purpose And May The Blessings Of Elves , And Men ,, And All Free Folk , Go With You.",The Fellowship of the Ring
1438,BOROMIR,You Are No Elf,The Fellowship of the Ring
1439,ARAGORN,Men Of The South Are Welcome Here,The Fellowship of the Ring
1440,BOROMIR,Who Are You ?,The Fellowship of the Ring
1441,ARAGORN,I'm A Friend Of Gandalf The Grey,The Fellowship of the Ring
1442,BOROMIR,"Then We Are Here On A Common Purpose , Friend.",The Fellowship of the Ring
1443,BOROMIR,"The Shards Of Narsil ,  The Blade That Cut The Ring From Sauron's Hand , Ah! ,its Still Sharp , But No More Than A Broken Heirloom",The Fellowship of the Ring
1444,ARWEN,"Why Do You Fear The Past.  You Are Isildur's Heir, Not Isildur Himself.  You Are Not Bound To His Fate",The Fellowship of the Ring
1445,PIPPIN,"He's Not Dead. He's Not Dead , No! No! He's Not Dead.",The Return of the King
1446,DENETHOR,Farewell Peregrin Son Of Paladin.,The Return of the King
1447,PIPPIN,No! No!,The Return of the King
1448,DENETHOR,"I Release You From My Service. ,go Now And Die And What Way Seems Best To You.",The Return of the King
1449,SOLDIER,"Come On Soldier, Move It.",The Return of the King
1450,SOLDIER,"Hurry Along There, Hurry Along.",The Return of the King
1451,PIPPIN,"Gandalf! , Where's Gandalf? , Gandalf!",The Return of the King
1452,SNAGA,Just A Mouthful......A Bit Of The Flank.,The Two Towers
1453,UGLUK,Looks Like Meat's Back On The Menuboys.,The Two Towers
1454,MERRY,Pippin.Let's Go.,The Two Towers
1455,GRISHNAKH,Go On.Call For Help. Squeal.No One's Going To Save You Now.,The Two Towers
1456,MERRY,Pippin!,The Two Towers
1457,PIPPIN,Aaaaaaaagh!,The Two Towers
1458,LEGOLAS,A Red Sun Rises.Blood Has Been Spilled This Night.,The Two Towers
1459,ARAGORN,Riders Of Rohan......What News From The Mark?,The Two Towers
1460,EOMER,"What Business Does An Elf, A Manand A Dwarf Have In The Riddermark?speak Quickly!",The Two Towers
1461,GIMLI,"Give Me Your Name, Horse-masterand I Shall Give You Mine.",The Two Towers
1462,EOMER,"I Would Cut Off Your Head, Dwarf......If It Stood But A Little Higherfrom The Ground.",The Two Towers
1463,LEGOLAS,You Would Die Before Your Stroke Fell.,The Two Towers
1464,ARAGORN,"I Am Aragorn, Son Of Arathorn.This Is Gimli, Son Of Gloinand Legolas Of The Woodland Realm.We Are Friends Of Rohanand Of Theoden, Your King.",The Two Towers
1465,EOMER,"Theoden No Longer Recognizesfriend From Foe. Not Even His Own Kin. ,saruman Has Poisoned The Mindof The King......And Claimed Lordship Over These Lands. My Company Are Those Loyal To Rohan.And For That, We Are Banished.The White Wizard Is Cunning.He Walks Here And There, They Say......As An Old Man Hooded And Cloaked.And Everywhere, His Spiesslip Past Our Nets.",The Two Towers
1466,SOLDIER,Very Good Sir.,The Return of the King
1467,THEODEN,Gamling.,The Return of the King
1468,GAMLING,My Lord!,The Return of the King
1469,THEODEN,Make Haste Across The Riddermark.  Summon Every Able-bodied Man To Dunharrow.,The Return of the King
1470,GAMLING,I Will.,The Return of the King
1471,ARAGORN,Do You Ride With Us?,The Return of the King
1472,EOWYN,"Just To The Encampment.  It's Tradition For The Women Of The Court To Farewell The Men.  ,  The Men Have Found Their Captain.  They Will Follow You Into Battle.  Even To Death.  You Have Given Us Hope.",The Return of the King
1473,MERRY,"Excuse Me!  , I Have A Sword.  Please Accept It!  , I Offer You My Service Theoden King.",The Return of the King
1474,THEODEN,"And Gladly, I Accept It.  ,  You Shall Be Meriadoc, Esquire Of Rohan.",The Return of the King
1475,GIMLI,"Horse Men!  I Wish I Could Muster An Army Of Dwarves, Fully Armed And Filthy.",The Return of the King
1476,LEGOLAS,Your Kinsmen May Have No Need To Ride To War.  I Fear War Already Marches On Their Own Lands.,The Return of the King
1478,EOMER,"Now Is The Hour, Riders Of Rohan.  Oaths You Have Taken.  Now Fulfil Them All, To Lord And Land!  Hah!",The Return of the King
1479,PIPPIN,Why Are There So Few Of Youwhen You Have Lived So Long? Are There Ent Children?,The Two Towers
1480,TREEBEARD,Bru-ra-hroom.There Have Been No Entingsfor A Terrible Long Count Of Years.,The Two Towers
1481,MERRY,Why Is That?,The Two Towers
1482,TREEBEARD,We Lost The Entwives.,The Two Towers
1483,PIPPIN,"Oh, I'm Sorry. How Did They Die?",The Two Towers
1484,TREEBEARD,Die? No.We Lost Them.And Now We Cannot Find Them. I Don't Suppose You've Seen Entwives In The Shire?,The Two Towers
1485,MERRY,"Can't Say That I Have. You, Pip?",The Two Towers
1486,PIPPIN,What Do They Look Like?,The Two Towers
1487,TREEBEARD,I Don't Remember Now.,The Two Towers
1488,GANDALF,"Edoras And The Golden Hall Of Meduseld. There Dwells Theoden, King Of Rohan...... Whose Mind Is Overthrown. Saruman's Hold Over King Theoden Is Now Very Strong.",The Two Towers
1489,EOWYN,"My Lord, Your Son......He Is Dead. , My Lord? Uncle? Will You Not Go To Him? Will You Do Nothing?",The Two Towers
1490,GANDALF,Be Careful What You Say.Do Not Look For Welcome Here.,The Two Towers
1491,GRIMA,"Oh, He Must Have Died Sometime In The Night. What A Tragedy For The King......To Lose His Only Son And Heir.",The Two Towers
1492,GANDALF,I've Sent Him To His Death.,The Return of the King
1493,ARAGORN,No. There Is Still Hope For Frodo. He Needs Time And Safe Passage Across The Plains Of Gorgoroth. We Can Give Him That.,The Return of the King
1494,GIMLI,How?,The Return of the King
1495,ARAGORN,Draw Out Sauron's Armies. Empty His Lands. Then We Gather Our Full Strength And March On The Black Gate.,The Return of the King
