Column,char,dialog,movie
1795,ARAGORN,They Crawled. Their Hands Were Bound.,The Two Towers
1796,ARAGORN,Their Bonds Were Cut.,The Two Towers
1797,ARAGORN,They Ran Over Here. They Were Followed,The Two Towers
1798,MERRY,"The Belt! ,run!",The Two Towers
1799,ARAGORN,Tracks Lead Away From The Battle...,The Two Towers
1800,ARAGORN,...Into Fangorn Forest.,The Two Towers
1801,GIMLI,Fangorn?what Madness Drove Them In There?,The Two Towers
1802,GANDALF,Theoden......Son Of Thengel......Too Long Have You Sat In The Shadows.,The Two Towers
1803,GIMLI,I Would Stay Still If I Were You.,The Two Towers
1804,GANDALF,Hearken To Me! I Release You......From The Spell.,The Two Towers
1805,THEODEN,"You Have No Power Here ......Gandalf The ,.",The Two Towers
1806,GANDALF,"I Will Draw You, Saruman, As Poison Is Drawn From A Wound.",The Two Towers
1807,ARAGORN,Wait.,The Two Towers
1808,THEODEN,"If I Go, Theoden Dies.",The Two Towers
1809,GANDALF,You Did Not Kill Me......You Will Not Kill Him.,The Two Towers
1810,THEODEN,Rohan Is Mine.,The Two Towers
1811,GANDALF,Be Gone.,The Two Towers
1812,THEODEN,"I Know Your Face., Eowyn. Eowyn. ,gandalf?",The Two Towers
1813,GANDALF,"Breathe The Free Air Again, My Friend.",The Two Towers
1814,THEODEN,Dark Have Been My Dreams Of Late.,The Two Towers
1815,ARAGORN,Man Cenich?,The Two Towers
1816,LEGOLAS,The White Wizard Approaches.,The Two Towers
1817,ARAGORN,Do Not Let Him Speak.He Will Put A Spell On Us.,The Two Towers
1818,ARAGORN,We Must Be Quick.,The Two Towers
1819,WHITE WIZARD,You Are Tracking The Footstepsof Two Young Hobbits.,The Two Towers
1820,ARAGORN,Where Are They?,The Two Towers
1821,ARAGORN,Who Are You?show Yourself!,The Two Towers
1822,ARAGORN,It Cannot Be.,The Two Towers
1823,LEGOLAS,Forgive Me.,The Two Towers
1824,LEGOLAS,I Mistook You For Saruman.,The Two Towers
1825,GANDALF,"I Am Saruman.Or Rather, Sarumanas He Should Have Been.",The Two Towers
1826,ARAGORN,You Fell.,The Two Towers
1827,GANDALF,Through Fire.....And Water.,The Two Towers
1828,GANDALF VOICEOVER,From The Lowest Dungeonto The Highest Peak...... I Fought With The Balrogof Morgoth.,The Two Towers
1829,GANDALF VOICE OVER,Until At Last I Threw Downmy Enemy......And Smote His Ruinupon The Mountainside.,The Two Towers
1830,SAM,No!,The Return of the King
1831,GOLLUM,"Hide, Hide!",The Return of the King
1832,FRODO,"I Can Feel His Blade.  ,",The Return of the King
1833,GANDALF,"We Come To It At Last.  ,the Great Battle Of Our Time.",The Return of the King
1834,GOLLUM,Come Away Hobbits.  We Climb.  We Must Climb.,The Return of the King
1835,GANDALF,"The Board Is Set, The Pieces Are Moving.",The Return of the King
1836,GOLLUM,"Up, Up, Up The Stairs We Go.  And Then It's Into The Tunnel.",The Return of the King
1837,SAM,"Hey,  What's In This Tunnel?  ,  You Listen To Me!  You Listen Good And Proper.  Anything Happens To Him, You'll Have Me To Answer To.   One Sniff That Something's Not Right, One Hair That Stands Up On The Back Of My Neck, Its Over.  No More Slinker, No More Stinker.  ,  You're Gone.  Got It?  I'm Watching You.",The Return of the King
1838,FRODO,What Was That About?,The Return of the King
1839,SAM,Nothing.  Just Clearing Something Up.,The Return of the King
1840,GANDALF,Gwaihir Go! Gwaihir,The Fellowship of the Ring
1841,PIPPIN,What Are They Saying ?,The Fellowship of the Ring
1842,ARWEN,"Frodo F'r. Ae Athradon I Hir, Tur Gwaith Nin Beriatha Hon.",The Fellowship of the Ring
1845,GAFFER,"There's Been Some Strange Folk Crossing The Shire. Dwarves, Others Of A Less Than Savoury Nature",The Fellowship of the Ring
1846,NOAKES,"War's Brewing. , The Mountains Are Fair Teeming With Goblins.",The Fellowship of the Ring
1847,SANDYMAN,Children's Stories That's All That Is.  You're Beginning To Sound Like That Old Bilbo Baggins! Cracked He Was!,The Fellowship of the Ring
1848,BILBO,"Hello, Hello, Fatty Bolger , lovely To See You, Welcome, Welcome",The Fellowship of the Ring
1849,FRODO,"Go On Sam, Ask Rosie For A Dance.",The Fellowship of the Ring
1850,ELROND,Take Her By The Safest Road. A Ship Lies Anchored In The Grey Havens. It Waits To Carry Her Across The Sea. The Last Journey Of Arwen Und'miel.,The Return of the King
1851,ELROND,There Is Nothing For You Here Only Death.,The Return of the King
1852,FIGWIT,"Lady Arwen We Cannot Delay. , My Lady!",The Return of the King
1853,ARWEN,Tell Me What You Have Seen.,The Return of the King
1854,ELROND,Arwen.,The Return of the King
1855,ARWEN,You Have The Gift Of Foresight. What Did You See?,The Return of the King
1856,ELROND,I Looked Into Your Future And I Saw Death.,The Return of the King
1857,ARWEN,But There Is Also Life. You Saw There Was A Child. You Saw My Son.,The Return of the King
1858,GALADRIEL VOICE OVER,"For Within These Rings Was Bound The Strength And Will To Govern Each Race. , But They Were All Of Them Deceived. ,for Another Ring Was Made. , In The Land Of Mordor, ,in The Fires Of Mount Doom , The Dark Lord Sauron Forged In Secret A Master Ring ,to Control All Others And Into This Ring He Poured All His Cruelty, His Malice , And His Will To Dominate All Life. , One Ring To Rule Them All.",The Fellowship of the Ring
1859,GALADRIEL VOICE OVER,"One By One The Free Lands Of Middle Earth Fell To The Power Of The Ring. But There Were Some Who Resisted. , A Last Alliance Of Elves And Men Marched Against The Armies Of Mordor. And On The Slopes Of Mount Doom They Fought For The Freedom Of Middle Earth.",The Fellowship of the Ring
1860,ELROND,Tangado Haid!,The Fellowship of the Ring
1861,ELROND,Leithio I Philinn!,The Fellowship of the Ring
1862,GALADRIEL VOICE OVER,"Victory Was Near. , But The Power Of The Ring , Could Not Be Undone.",The Fellowship of the Ring
1863,GALADRIEL VOICE OVER,"It Was In This Moment, ,that Isildur, Son Of The King, Took Up His Father's Sword.",The Fellowship of the Ring
1864,GALADRIEL VOICE OVER,"Sauron, The Enemy Of The Free Peoples Of Middle Earth Was Defeated. , The Ring Passed To Isildur. , Who Had This One Chance To Destroy Evil Forever. , But The Hearts Of Men Are Easily Corrupted. , And The Ring Of Power Has A Will Of Its Own.",The Fellowship of the Ring
1865,GALADRIEL VOICE OVER,"It Betrayed Isildur ,to His Death. ,and Some Things That Should Not Have Been Forgotten Were Lost. ,history Became Legend, Legend Became Myth, , And For Two And A Half Thousand Years The Ring Passed Out Of All Knowledge. , Until, When Chance Came , It Ensnared A New Bearer.",The Fellowship of the Ring
1866,GOLLUM,My Precious!,The Fellowship of the Ring
1867,GALADRIEL VOICE OVER,"The Ring Came To The Creature Gollum Who Took It Deep Into The Tunnels Of The Misty Mountains. , And There It Consumed Him.",The Fellowship of the Ring
1868,GOLLUM,"It Came To Me, My Own, My Love, My Own, My Precious.",The Fellowship of the Ring
1869,GALADRIEL VOICE OVER,"The Ring Brought To Gollum Unnatural Long Life. For Five Hundred Years It Poisoned His Mind. And In The Gloom Of Gollum's Cave It Waited. , Darkness Crept Back Into The Forests Of The World. Rumour Grew Of A Shadow In The East, Whispers Of A Nameless Fear. , And The Ring Of Power Perceived. , Its Time Had Now Come. , It Abandoned Gollum. , But Something Happened Then That The Ring Did Not Intend, It Was Picked Up By The Most Unlikely Creature Imaginable.",The Fellowship of the Ring
1870,BILBO,What's This?,The Fellowship of the Ring
1871,GALADRIEL VOICE OVER,A Hobbit. Bilbo Baggins Of The Shire.,The Fellowship of the Ring
1872,GIMLI,And No Regurgitation!,The Return of the King
1873,LEGOLAS,So' It's A Drinking Game?,The Return of the King
1874,ROHIRRIM,Aye!,The Return of the King
1875,GIMLI,Last One Standing Wins Heh Heh Heh!,The Return of the King
1876,GENERAL SHOUT,Lets Drink To Victory! To Victory!,The Return of the King
1877,EOWYN,"West' Aragorn, Hal",The Return of the King
1878,THEODEN,I Am Very Happy For You. He Is An Honourable Man.,The Return of the King
1879,EOWYN,You Are Both Honourable Men.,The Return of the King
1880,THEODEN,It Was Not Theoden Of Rohan Who Led Our People To Victory.,The Return of the King
1881,THEODEN,"Ach, Don't Listen To Me. You Are Young And Tonight Is For You.",The Return of the King
1882,GIMLI,"Heh Heh Heh Heh ,here, Here. , Raaar It's The Dwarves That Go Swimming With Little, Hairy Women Haha",The Return of the King
1883,LEGOLAS,"I Feel Something. , A Slight Tingle In My Fingers. I Think It's Affecting Me.",The Return of the King
1884,GIMLI,"Heh Heh Heh , What Did I Say? He Can't Hold His Liquor.",The Return of the King
1885,LEGOLAS,Game Over!,The Return of the King
1886,MERRY and PIPPIN,"Oh You Can Search Far And Wide, You Can Drink The Whole Town Dry , But You'll Never Find A Beer So Brown, But You'll Never Find A Beer So Brown, As The One We Drink In Our Hometown, As The One We Drink In Our Hometown. ,you Can Drink Your Fancy Ales, You Can Drink Them By The Flagon But The Only Brew For The Brave And True,",The Return of the King
1887,PIPPIN,Nothing's Happening,The Fellowship of the Ring
1888,GANDALF,"I Once Knew Every Spell In All The Tongues Of Elves, Men And Orcs",The Fellowship of the Ring
1889,PIPPIN,What're You Going To Do Then ?,The Fellowship of the Ring
1890,GANDALF,Knock Your Head Against These Doors Peregrin Took! And If That Does Not Shatter Them And I'm Allowed A Little Peace From Foolish Questions I Will Try To Find The Opening Words.,The Fellowship of the Ring
1891,GANDALF,"Ando Eldarinwa'a Lasta Quettanya, Fenda Casarinwa'",The Fellowship of the Ring
1892,ARAGORN,The Mines Are No Place For A Pony Even One So Brave As Bill.,The Fellowship of the Ring
1893,SAM,Bubye Bill,The Fellowship of the Ring
1894,ARAGORN,"Go On, Go On ,don't Worry Sam.  He Knows The Way Home. ,",The Fellowship of the Ring
1895,ARAGORN,Do Not Disturb The Water,The Fellowship of the Ring
1896,GANDALF,Oh It's Useless,The Fellowship of the Ring
1897,FRODO,It's A Riddle!,The Fellowship of the Ring
1898,FRODO,Speak Friend... And Enter.  What's The Elvish Word For Friend ?,The Fellowship of the Ring
1899,GANDALF,Mel..Lon,The Fellowship of the Ring
1900,GOLLUM,"No. Ashes And Dust And Thirst There Isand Pits, Pits, Pits.And Orcses, Thousands Of Orcses.And Always The Great Eye Watching,watching.",The Two Towers
1901,SAM,"Hey! Come Back Now! Come Back!there! What Did I Tell You?he's Run Off, The Old Villain.So Much For His Promises.",The Two Towers
1902,SMEAGOL,"This Way, Hobbits.Follow Me!",The Two Towers
1903,PIPPIN,Merry!merry!,The Two Towers
1904,GRISHNAK,You're Lateour Master Grows Impatient.He Wants The Shire-rats Now.,The Two Towers
1905,UGLUK,I Don't Take Orders From Orc-maggots.Saruman Will Have His Prize.We Will Deliver Them.,The Two Towers
1906,PIPPIN,Merry! Merry? Wake Up,The Two Towers
1907,PIPPIN,My Friend Is Sick.He Needs Water. Please!,The Two Towers
1908,URUK HAI,"Sick, Is He?give Him Some Medicine, Boys!",The Two Towers
1909,PIPPIN,Stop It!,The Two Towers
1910,URUK HAI,Can't Take His Draught!,The Two Towers
1911,PIPPIN,Leave Him Alone!,The Two Towers
1912,URUK HAI,Why?you Want Some?,The Two Towers
1913,URUK HAI,Then Keep Your Mouth Shut.,The Two Towers
1914,MERRY,"Yes Pippin, My Point Is, He's Clearly Over Reacting! Run!",The Fellowship of the Ring
1915,PIPPIN,Ooh!  That Was Close!,The Fellowship of the Ring
1916,MERRY,Oh! I Think I've Broken Something,The Fellowship of the Ring
1917,SAM,Trust A Brandybuck And A Took!,The Fellowship of the Ring
1918,MERRY,What?  It Was Just A Detour. A Shortcut,The Fellowship of the Ring
1919,SAM,A Shortcut To What ?,The Fellowship of the Ring
1920,PIPPIN,Mushrooms!,The Fellowship of the Ring
1921,FRODO,I Think We Should Get Off The Road.,The Fellowship of the Ring
1922,FRODO,Get Off The Road! Quick!,The Fellowship of the Ring
1923,SAM,Ssh.. Be Quiet,The Fellowship of the Ring
1924,MERRY,What Was That!,The Fellowship of the Ring
1925,SAM,Anything ?,The Fellowship of the Ring
1926,FRODO,Nothing,The Fellowship of the Ring
1927,PIPPIN,What Is Going On ?,The Fellowship of the Ring
1928,SARUMAN,"So Gandalf, You Try To Lead Them Over Caradhras.  And If That Fails, Where Then Will You Go ?",The Fellowship of the Ring
1929,SARUMAN VOICEOVER,If The Mountain Defeats You Will You Risk A More Dangerous Road,The Fellowship of the Ring
1930,SARUMAN,Cuiva Nwalca Carnirasse; Nai Yarvaxea Rasselya!,The Fellowship of the Ring
1931,LEGOLAS,There Is A Fell Voice On The Air,The Fellowship of the Ring
1932,GANDALF,It's Saruman!,The Fellowship of the Ring
1933,ARAGORN,He's Trying To Bring Down The Mountain! Gandalf! We Must Turn Back!,The Fellowship of the Ring
1934,GANDALF,"No! , Losto Caradhras, Sedho, Hodo, Nuitho I 'ruith!",The Fellowship of the Ring
1935,SARUMAN,Cuiva Nwalca Carnirasse; Nai Yarvaxea Rasselya; Taltuva Notto-carinnar!,The Fellowship of the Ring
1936,BOROMIR,We Must Get Off The Mountain! Make For The Gap Of Rohan And Take The West Road To My City!,The Fellowship of the Ring
1937,ARAGORN,The Gap Of Rohan Takes Us Too Close To Isengard!,The Fellowship of the Ring
1938,GIMLI,"If We Cannot Pass Over The Mountain, Let Us Go Under It! Let Us Go Through The Mines Of Moria",The Fellowship of the Ring
1939,SARUMAN VOICEOVER,Moria... You Fear To Go Into Those Mines.,The Fellowship of the Ring
1940,SARUMAN,The Dwarves Delved Too Greadily And Too Deep,The Fellowship of the Ring
1941,SARUMAN VOICEOVER,You Know What They Woke In The Dark Of Khazad-d'm,The Fellowship of the Ring
1942,SARUMAN,"Shadow, Flame",The Fellowship of the Ring
1943,BOROMIR,"One Does Not Simply Walk Into Mordor.  Its Black Gates Are Guarded By More Than Just Orcs. There Is Evil There That Does Not Sleep And The Great Eye Is Ever Watchful.  Tis A Barren Wasteland, Riddled With Fire And Ash And Dust.  The Very Air You Breathe Is A Poisonous Fume.  Not With Ten Thousand Men Could You Do This. ,it Is Folly",The Fellowship of the Ring
1944,LEGOLAS,Have You Heard Nothing Lord Elrond Has Said? The Ring Must Be Destroyed,The Fellowship of the Ring
1945,GIMLI,And I Suppose You Think You're The One To Do It.,The Fellowship of the Ring
1946,BOROMIR,"And If We Fail What Then ? , What Happens When Sauron Takes Back What Is His ?",The Fellowship of the Ring
1947,GIMLI,I Will Be Dead Before I See The Ring In The Hands Of An Elf,The Fellowship of the Ring
1948,GIMLI,Never Trust An Elf,The Fellowship of the Ring
1949,GANDALF,"Do You Not Understand That While We Bicker Amongst Ourselves, Sauron's Power Grows?! None Can Escape It! You'll All Be Destroyed",The Fellowship of the Ring
1950,GANDALF,Your Fingers Would Remember Their Old Strength Better......If They Grasped Your Sword.,The Two Towers
1951,GRIMA,"I've Only......Ever Served You, My Lord.",The Two Towers
1952,THEODEN,Your Leechcraft Would Have Had Me Crawling On All Fours Like A Beast!,The Two Towers
1953,GRIMA,Send Me Not From Your Sight.,The Two Towers
1954,ARAGORN,"No, My Lord! No, My Lord. Let Him Go. Enough Blood Has Been Spilt On His Account.",The Two Towers
1955,GRIMA,Get Out Of My Way!,The Two Towers
1956,HAMA,"Hail, Theoden King!",The Two Towers
1957,THEODEN,Where Is Theodred? Where Is My Son?,The Two Towers
1958,GANDALF VOICE OVER,Darkness Took Me......And I Strayed Out Of Thoughtand Time.,The Two Towers
1959,GANDALF VOICE OVER,Stars Wheeled Overhead......And Every Day Was As Longas A Life Age Of The Earth.But It Was Not The End.I Felt Life In Me Again.,The Two Towers
1960,GANDALF,I've Been Sent Back...... Until My Task Is Done.,The Two Towers
1961,ARAGORN,Gandalf.,The Two Towers
1962,GANDALF,"Gandalf? ,yes.That Was What They Used To Call Me.Gandalf The Grey.That Was My Name.",The Two Towers
1963,GIMLI,Gandalf.,The Two Towers
1964,GANDALF,I Am Gandalf The White.And I Come Back To You Now......At The Turn Of The Tide.,The Two Towers
1965,GANDALF,One Stage Of Your Journey Is Over.Another Begins. We Must Travel To Edoras With All Speed.,The Two Towers
1966,GIMLI,Edoras?that Is No Short Distance!,The Two Towers
1967,ARAGORN,We Hear Of Trouble In Rohan.It Goes Ill With The King.,The Two Towers
1968,GANDALF,"Yes, And It Will Not Be Easily Cured.",The Two Towers
1969,GIMLI,"Then We Have Run All This Way For Nothing?are We To Leave Those Poor Hobbits Here......In This Horrid, Dark, Dank Tree-infested--? ,i Mean, Charming......Quite Charming Forest.",The Two Towers
1970,GANDALF,It Was More Than Mere Chance Thatbrought Merry And Pippin To Fangorn.A Great Power Has Been Sleeping Herefor Many Long Years.The Coming Of Merry And Pippinwill Be Like The Falling Of Small Stones......That Starts An Avalanchein The Mountains.,The Two Towers
1971,ARAGORN,"In One Thing You Have Not Changeddear Friend.,you Still Speak In Riddles.",The Two Towers
1972,GANDALF,A Thing Is About To Happen That Has Nothappened Since The Elder Days.The Ents Are Going To Wake Up.....And Find That They Are Strong.,The Two Towers
1973,GAFFER,"Young Mr Frodo Here, He's Cracking!",The Fellowship of the Ring
1974,FRODO,And Proud Of It! Cheers Gaffer!,The Fellowship of the Ring
1975,GAFFER,Cheers,The Fellowship of the Ring
1976,SANDYMAN,Well It's None Of Our Concern What Goes On Beyond Our Borders. Keep Your Nose Out Of Trouble And No Trouble Will Come To You.,The Fellowship of the Ring
1977,ROSIE,Good Night Lads,The Fellowship of the Ring
1978,HOBBIT,"Good Night, Sweet Maiden Of The Golden Ale!",The Fellowship of the Ring
1979,SAM,Oi Mind Who You're Sweet Talking!,The Fellowship of the Ring
1980,FRODO,"Don't Worry Sam, Rosie Knows An Idiot When She Sees One!",The Fellowship of the Ring
1981,SAM,Does She ?,The Fellowship of the Ring
1982,FRODO,Good Night Sam,The Fellowship of the Ring
1983,GANDALF,Is It Secret ? Is It Safe ?,The Fellowship of the Ring
1984,FRODO,"Ha! , What Are You Doing!",The Fellowship of the Ring
1985,GANDALF,"Hold Out Your Hand Frodo. Its Quite Cool.  ,  What Can You See ? , Can You See Anything ?",The Fellowship of the Ring
1986,FRODO,"Nothing. There's Nothing , Wait. There Are Markings ,  Its Some Form Of Elvish.  I Can't Read It",The Fellowship of the Ring
1987,GANDALF,"There Are Few Who Can. The Language Is That Of Mordor, Which I Will Not Utter Here.",The Fellowship of the Ring
1988,SAM,"Ah, I Think I'll Just Have Another Ale.",The Fellowship of the Ring
1989,FRODO,"Oh No You Dont , Go On",The Fellowship of the Ring
1990,BILBO,"So There I Was At The Mercy Of Three Monstrous Trolls And They Were All Arguing Amongst Themselves About How They Were Going To Cook Us. Whether It Be Turned On A Spit Or Whether They Should Sit On Us One By One And Squash Us Into Jelly. , they Spent So Much Time Arguing The Witherto's And Whyfor's That The Sun's First Light Cracked Open Over The Top Of The Trees.  Poof! , And Turned Them All Into Stone!",The Fellowship of the Ring
1991,MERRY,Quickly,The Fellowship of the Ring
1992,MERRY,"No No! The Big One, Big One!",The Fellowship of the Ring
1993,BILBO,"Mrs Bracegirdle, How Nice To See You.  Welcome Welcome.  Are All These Children Yours ?",The Fellowship of the Ring
1994,MRS BRACEGIRDLE,Yeah,The Fellowship of the Ring
1995,BILBO,Good Gracious You Have Been Productive!,The Fellowship of the Ring
1996,BILBO,"Sackville-bagginses! , Quickly! Hide!",The Fellowship of the Ring
1997,BILBO,"Oh! Thankyou My Boy You're A Good Lad Frodo. I'm Very Selfish You Know. , yes, I Am.  Very Selfish. I Don't Know Why I Took You In After Your Mother And Father Died, But It Wasn't Out Of Charity. I Think It Was Because, Of All My Numerous Relations, You Were The One Baggins That Showed Real Spirit.",The Fellowship of the Ring
1998,FRODO,Bilbo Have You Been At The Gaffers Homebrew ?,The Fellowship of the Ring
1999,BILBO,"No. Well Yes, B B B But Thats Not The Point. The Point Is, Frodo, , You'll Be Alright.",The Fellowship of the Ring
2000,ELROND,That Future Is Almost Gone.,The Return of the King
2001,ARWEN,But It Is Not Lost.,The Return of the King
2002,ELROND,Nothing Is Certain.,The Return of the King
2003,ARWEN,Some Things Are Certain.,The Return of the King
2004,ARWEN,"If I Leave Him Now, I Will Regret It Forever. It Is Time.",The Return of the King
2005,ARWEN,"From The Ashes Of Fire Shall Be Woken, A Light From The Shadow Shall Spring, Renewed Shall Be Blade That Was Broken, The Crownless Again Shall Be King.",The Return of the King
2006,ARWEN,Reforge The Sword' Ada.,The Return of the King
2007,ELROND,Your Hands Are Cold. The Life Of The Eldar Is Leaving You.,The Return of the King
2008,ARWEN,"This Was My Choice. Ada, Whether By Your Will Or Not There Is No Ship Now That Can Bear Me Hence.",The Return of the King
2009,GANDALF,We Have Just Passed Into The Realm Of Gondor.,The Return of the King
2010,GANDALF,Minas Tirith. City Of Kings.,The Return of the King
2011,PIPPIN,"It's The Tree! Gandalf, Gandalf.",The Return of the King
2012,GANDALF,"Yes The White Tree Of Gondor. The Tree Of The King. Lord Denethor However, Is Not The King. He Is A Steward Only, A Caretaker Of The Throne.",The Return of the King
2013,GANDALF,"Now Listen Carefully. Lord Denethor Is Boromir's Father. To Give Him News Of His Beloved Son's Death Would Be Most Unwise. And Do Not Mention Frodo Or The Ring. And Say Nothing Of Aragorn Either. In Fact, Its Better If You Don't Speak At All Peregrin Took.",The Return of the King
2014,GANDALF,"Hail Denethor Son Of Ecthelion, Lord And Steward Of Gondor.",The Return of the King
2015,BILBO,A Ring!,The Fellowship of the Ring
2016,GOLLUM,"Lost! , My Precious Is Lost.",The Fellowship of the Ring
2017,GALADRIEL,For The Time Will Soon Come When Hobbits Will Shape The Fortunes Of All.,The Fellowship of the Ring
2018,BILBO,"The 22nd Day Of September In The Year 1400 ,by Shire Reckoning. , Bag End, Bagshot Row, Hobbiton, West Farthing, The Shire, Middle Earth. , The Third Age Of This World.",The Fellowship of the Ring
2019,BILBO,"There And Back Again, A Hobbit's Tale, By Bilbo Baggins. ,now, Where To Begin? Ah, Yes. ,concerning Hobbits.",The Fellowship of the Ring
2020,BILBO VOICEOVER,"Hobbits Have Been Living And Farming In The Four Farthings Of The Shire For Many Hundreds Of Years. , Quite Content To Ignore And Be Ignored By The World Of The Big Folk. , Middle Earth Being, After All, Full Of Strange Creatures Beyond Count. Hobbits Must Seem Of Little Importance, Being Neither Renowned As Great Warriors, Nor Counted Amongst The Very Wise.",The Fellowship of the Ring
2021,BILBO,"Frodo, Someone At The Door. ,in Fact, It Has Been Remarked By Some That Hobbits' Only Real Passion Is For Food. , A Rather Unfair Observation , As We Have Also Developed A Keen Interest In The Brewing Of Ales ,and The Smoking Of Pipeweed. , But Where Our Hearts Truly Lie , Is In Peace And Quiet ,and Good Tilled Earth. ,for All Hobbits Share A Love Of All Things That Grow. ,and Yes, No Doubt To Others, Our Ways Seem Quaint , But Today Of All Days, It Is Brought Home To Me It Is No Bad Thing To Celebrate A Simple Life.",The Fellowship of the Ring
2022,BILBO,"Frodo, The Door! , Sticklebacks, Where Is That Boy! Frodo!",The Fellowship of the Ring
2023,GANDALF,"Hmm Hmm Hmm Hmm, Down From The Door Where It Began, Hmm Hmm Hmm Hmm",The Fellowship of the Ring
2024,GANDALF,"And I Must Follow If I Can. , The Road Goes Ever On And On, Down From The Door Where It Began, Now Far Ahead The Road Has Gone, And I Must Follow If I Can.",The Fellowship of the Ring
2025,FRODO,You're Late!,The Fellowship of the Ring
2026,MERRY,Pippin!,The Return of the King
2027,MERRY and PIPPIN,Comes From The Green Dragon!,The Return of the King
2028,MERRY,Thank You! I Win!,The Return of the King
2029,ARAGORN,No News Of Frodo?,The Return of the King
2030,GANDALF,No Word. Nothing.,The Return of the King
2031,ARAGORN,We Have Time. Every Day Frodo Moves Closer To Mordor.,The Return of the King
2032,GANDALF,Do We Know That?,The Return of the King
2033,ARAGORN,What Does Your Heart Tell You?,The Return of the King
2034,GANDALF,That Frodo Is Alive. Yes' Yes He's Alive.,The Return of the King
2035,GOLLUM,"Too Risky. Too Risky. ,thieves. They Stole It From Us. Kill Them, Kill Them, Kill Them Both! ,",The Return of the King
2036,SMEAGOL,No!,The Return of the King
2037,GOLLUM,"Sshh, Quiet, Mustn't Wake Them. Mustn't Ruin It Now.",The Return of the King
2038,SMEAGOL,"But They Knows, , They Knows, They Suspects Us!",The Return of the King
2039,GOLLUM,"What's It Saying My Precious, My Love? Is Smeagol Losing His Nerve?",The Return of the King
2040,GIMLI,"Soon Mr Elf, You Will Enjoy The Fabelled Hospitality Of The Dwarves. Roaring Fires! Malt Beer! Red Meat Off The Bone!",The Fellowship of the Ring
2041,GIMLI,This My Friend Is The Home Of My Cousin Balin And They Call It A Mine!,The Fellowship of the Ring
2042,GIMLI,A Mine!,The Fellowship of the Ring
2043,BOROMIR,"This Isn't A Mine, It's A Tomb",The Fellowship of the Ring
2044,GIMLI,Nooooo! Noooooooooooooooooo!,The Fellowship of the Ring
2045,LEGOLAS,Goblins!,The Fellowship of the Ring
2046,BOROMIR,We Make For The Gap Of Rohan.  We Should Never Have Come Here,The Fellowship of the Ring
2047,BOROMIR,Now Get Out Of Here! Get Out!,The Fellowship of the Ring
2048,PIPPIN,Merry.,The Two Towers
2049,MERRY,"Hello, Pip.",The Two Towers
2050,PIPPIN,You're Hurt.,The Two Towers
2051,MERRY,I'm Fine. Lt Was Just An Act.,The Two Towers
2052,PIPPIN,An Act?,The Two Towers
2053,MERRY,"See? I Fooled You Too.Don't Worry About Me, Pippin.",The Two Towers
2054,UGLUK,What Is It? What Do You Smell?,The Two Towers
2055,URUK HAI,Man-flesh,The Two Towers
2056,UGLUK,They've Picked Up Our Trail.,The Two Towers
2057,PIPPIN,Aragorn.,The Two Towers
2058,UGLUK,Let's Move!,The Two Towers
2059,MERRY,That Black Rider Was Looking For Something. Or Someone (he Walks Up To Frodo And Looks Him In The Face) Frodo ?,The Fellowship of the Ring
2060,PIPPIN,Get Down!,The Fellowship of the Ring
2061,FRODO,"I Have To Leave The Shire. ,sam And I Must Get To Bree",The Fellowship of the Ring
2062,MERRY,Right. Bucklebury Ferry.  Follow Me.,The Fellowship of the Ring
2063,PIPPIN,Run!,The Fellowship of the Ring
2064,MERRY,"Frodo, This Way.  Follow Me",The Fellowship of the Ring
